{
  "$schema": "http://json-schema.org/draft-07/schema#",
  "type": "object",
  "required": [
    "mapping"
  ],
  "properties": {
    "meta": {
      "type": "object",
      "properties": {
        "version": { "type": "string", "description": "Auto-generated timestamp or ID" },
        "comment": { "type": "string", "description": "User description of this configuration state" },
        "author": { "type": "string" },
        "created": { "type": "string", "format": "date-time" }
      }
    },
    "discover_prefix": {
      "type": "string",
      "default": ""
    },
    "connection": {
      "type": "object",
      "properties": {
        "keep_alive": {
          "type": "integer",
          "default": 60
        },
        "client_id": {
          "type": "string",
          "default": ""
        },
        "clean_session": {
          "type": "boolean",
          "default": true
        },
        "will_topic": {
          "type": "string",
          "default": ""
        },
        "will_message": {
          "type": "string",
          "default": ""
        },
        "will_qos": {
          "type": "integer",
          "default": 0,
          "minimum": 0,
          "maximum": 2
        },
        "will_retain": {
          "type": "boolean",
          "default": false
        },
        "username": {
          "type": "string",
          "default": ""
        },
        "password": {
          "type": "string",
          "default": ""
        }
      },
      "default": {
        "keep_alive": 60,
        "client_id": "",
        "clean_session": true,
        "will_topic": "",
        "will_message": "",
        "will_qos": 0,
        "will_retain": false,
        "username": "",
        "password": ""
      }
    },
    "mapping": {
      "$id": "https://www.vchrist.at/mqttmapper/schemas/mapping",
      "type": "object",
      "required": [
        "topic_level"
      ],
      "properties": {
        "plugins": {
          "$id": "https://www.vchrist.at/mqttmapper/schemas/plugins",
          "type": "array",
          "items": {
            "type": "string"
          }
        },
        "topic_level": {
          "$id": "https://www.vchrist.at/mqttmapper/schemas/topic_level",
          "oneOf": [
            {
              "$ref": "#/$defs/topic_level"
            },
            {
              "type": "array",
              "items": {
                "$ref": "#/$defs/topic_level"
              }
            }
          ],
          "$defs": {
            "topic_level": {
              "type": "object",
              "required": [
                "name"
              ],
              "anyOf": [
                {
                  "required": [
                    "topic_level"
                  ]
                },
                {
                  "required": [
                    "subscription"
                  ]
                }
              ],
              "properties": {
                "name": {
                  "type": "string",
                  "pattern": "^(?:[^#+]{2,}|.)$",
                  "minLength": 1
                },
                "topic_level": {
                  "$ref": "#"
                },
                "subscription": {
                  "type": "object",
                  "properties": {
                    "qos": {
                      "type": "integer",
                      "minimum": 0,
                      "maximum": 2,
                      "default": 0
                    },
                    "type": {
                      "type": "string",
                      "default": ""
                    }
                  },
                  "anyOf": [
                    {
                      "$ref": "#/$defs/mapping_static"
                    },
                    {
                      "$ref": "#/$defs/mapping_value"
                    },
                    {
                      "$ref": "#/$defs/mapping_json"
                    }
                  ]
                }
              }
            },
            "mapping_static": {
              "type": "object",
              "required": [
                "static"
              ],
              "properties": {
                "static": {
                  "oneOf": [
                    {
                      "$ref": "#/$defs/static_mapping"
                    },
                    {
                      "type": "array",
                      "items": {
                        "$ref": "#/$defs/static_mapping"
                      }
                    }
                  ]
                }
              }
            },
            "mapping_value": {
              "type": "object",
              "required": [
                "value"
              ],
              "properties": {
                "value": {
                  "oneOf": [
                    {
                      "$ref": "#/$defs/template_mapping"
                    },
                    {
                      "type": "array",
                      "items": {
                        "$ref": "#/$defs/template_mapping"
                      }
                    }
                  ]
                }
              }
            },
            "mapping_json": {
              "type": "object",
              "required": [
                "json"
              ],
              "properties": {
                "json": {
                  "oneOf": [
                    {
                      "$ref": "#/$defs/template_mapping"
                    },
                    {
                      "type": "array",
                      "items": {
                        "$ref": "#/$defs/template_mapping"
                      }
                    }
                  ]
                }
              }
            },
            "static_mapping": {
              "type": "object",
              "allOf": [
                {
                  "$ref": "#/$defs/mapping_commons"
                }
              ],
              "required": [
                "message_mapping"
              ],
              "properties": {
                "message_mapping": {
                  "oneOf": [
                    {
                      "$ref": "#/$defs/message_mapping"
                    },
                    {
                      "type": "array",
                      "items": {
                        "$ref": "#/$defs/message_mapping"
                      },
                      "minItems": 1
                    }
                  ]
                }
              }
            },
            "message_mapping": {
              "type": "object",
              "required": [
                "message",
                "mapped_message"
              ],
              "properties": {
                "message": {
                  "type": "string",
                  "minLength": 1
                },
                "mapped_message": {
                  "type": "string",
                  "minLength": 1
                }
              }
            },
            "template_mapping": {
              "type": "object",
              "allOf": [
                {
                  "$ref": "#/$defs/mapping_commons"
                }
              ],
              "required": [
                "mapping_template"
              ],
              "properties": {
                "mapping_template": {
                  "type": "string",
                  "minLength": 1
                },
                "suppressions": {
                  "type": "array",
                  "items": {
                    "type": "string"
                  },
                  "default": [
                  ]
                }
              }
            },
            "mapping_commons": {
              "type": "object",
              "required": [
                "mapped_topic"
              ],
              "properties": {
                "mapped_topic": {
                  "type": "string",
                  "pattern": "(\\{\\{\\s*[^\\{\\}]+?\\s*\\}\\}|\\{\\{\\s*#\\s*[^\\{\\}]+?\\s*\\}\\}|\\{\\{\\s*/\\s*[^\\{\\}]+?\\s*\\}\\})|^[^#+]*$",
                  "minLength": 1
                },
                "retain": {
                  "type": "boolean",
                  "default": false
                },
                "qos": {
                  "type": "integer",
                  "minimum": 0,
                  "maximum": 2,
                  "default": 0
                },
                "delay": {
                  "type": "number",
                  "oneOf": [
                    { "const": -1 },
                    { "minimum": 0 }
                  ],
                  "default": -1
                }
              }
            }
          }
        }
      }
    }
  }
}
